{"cases":{"cards":[],"compounds":[{"id":"compound-hashiridasu","input":{"dictionary_terms":["走り出す"],"text":"彼は急に走り出した。"},"output":{"words":[{"expression_furigana":"彼[かれ]","expression_reading":"かれ","highlight_end":1,"lemma":"彼","mined_form":"彼","orth_base":"彼","pos":"代名詞","reading":"カレ","sentence":"彼は急に走り出した。","sentence_furigana":"彼[かれ]は 急[きゅう]に 走[はし]り 出[だ]した。","sentence_reading":"かれはきゅうにはしりだした。","surface":"彼","surface_end":1,"surface_start":0},{"expression_furigana":"急[きゅう]","expression_reading":"きゅう","highlight_end":3,"lemma":"急","mined_form":"急","orth_base":"急","pos":"名詞","reading":"キュウ","sentence":"彼は急に走り出した。","sentence_furigana":"彼[かれ]は 急[きゅう]に 走[はし]り 出[だ]した。","sentence_reading":"かれはきゅうにはしりだした。","surface":"急","surface_end":3,"surface_start":2},{"expression_furigana":"走[はし]り 出[だ]す","expression_reading":"はしりだす","highlight_end":9,"lemma":"走り出す","mined_form":"走り出す","orth_base":"走り出す","pos":"動詞","reading":"はしりだす","sentence":"彼は急に走り出した。","sentence_furigana":"彼[かれ]は 急[きゅう]に 走[はし]り 出[だ]した。","sentence_reading":"かれはきゅうにはしりだした。","surface":"走り出し","surface_end":8,"surface_start":4}]}}],"deinflection":[],"dictionaries":[],"filtering":[],"frequency":[],"morphology":[{"id":"variant-yaru","input":{"text":"奴を殺る。"},"output":{"words":[{"expression_furigana":"奴[やつ]","expression_reading":"やつ","highlight_end":1,"lemma":"奴","mined_form":"奴","orth_base":"奴","pos":"名詞","reading":"ヤツ","sentence":"奴を殺る。","sentence_furigana":"奴[やつ]を 殺[や]る。","sentence_reading":"やつをやる。","surface":"奴","surface_end":1,"surface_start":0},{"expression_furigana":"殺[や]る","expression_reading":"やる","highlight_end":4,"lemma":"遣る","mined_form":"殺る","orth_base":"殺る","pos":"動詞","reading":"ヤル","sentence":"奴を殺る。","sentence_furigana":"奴[やつ]を 殺[や]る。","sentence_reading":"やつをやる。","surface":"殺る","surface_end":4,"surface_start":2}]}},{"id":"variant-kakeru","input":{"text":"人生を賭ける。"},"output":{"words":[{"expression_furigana":"人生[じんせい]","expression_reading":"じんせい","highlight_end":2,"lemma":"人生","mined_form":"人生","orth_base":"人生","pos":"名詞","reading":"ジンセイ","sentence":"人生を賭ける。","sentence_furigana":"人生[じんせい]を 賭[か]ける。","sentence_reading":"じんせいをかける。","surface":"人生","surface_end":2,"surface_start":0},{"expression_furigana":"賭[か]ける","expression_reading":"かける","highlight_end":6,"lemma":"掛ける","mined_form":"賭ける","orth_base":"賭ける","pos":"動詞","reading":"カケル","sentence":"人生を賭ける。","sentence_furigana":"人生[じんせい]を 賭[か]ける。","sentence_reading":"じんせいをかける。","surface":"賭ける","surface_end":6,"surface_start":3}]}},{"id":"compound-hashiridasu","input":{"text":"彼は急に走り出した。"},"output":{"words":[{"expression_furigana":"彼[かれ]","expression_reading":"かれ","highlight_end":1,"lemma":"彼","mined_form":"彼","orth_base":"彼","pos":"代名詞","reading":"カレ","sentence":"彼は急に走り出した。","sentence_furigana":"彼[かれ]は 急[きゅう]に 走[はし]り 出[だ]した。","sentence_reading":"かれはきゅうにはしりだした。","surface":"彼","surface_end":1,"surface_start":0},{"expression_furigana":"急[きゅう]","expression_reading":"きゅう","highlight_end":3,"lemma":"急","mined_form":"急","orth_base":"急","pos":"名詞","reading":"キュウ","sentence":"彼は急に走り出した。","sentence_furigana":"彼[かれ]は 急[きゅう]に 走[はし]り 出[だ]した。","sentence_reading":"かれはきゅうにはしりだした。","surface":"急","surface_end":3,"surface_start":2},{"expression_furigana":"走[はし]り 出[だ]す","expression_reading":"はしりだす","highlight_end":9,"lemma":"走り出す","mined_form":"走り出す","orth_base":"走り出す","pos":"動詞","reading":"はしりだす","sentence":"彼は急に走り出した。","sentence_furigana":"彼[かれ]は 急[きゅう]に 走[はし]り 出[だ]した。","sentence_reading":"かれはきゅうにはしりだした。","surface":"走り出し","surface_end":8,"surface_start":4}]}},{"id":"potential-tamoteru","input":{"text":"秩序を保てる。"},"output":{"words":[{"expression_furigana":"秩序[ちつじょ]","expression_reading":"ちつじょ","highlight_end":2,"lemma":"秩序","mined_form":"秩序","orth_base":"秩序","pos":"名詞","reading":"チツジョ","sentence":"秩序を保てる。","sentence_furigana":"秩序[ちつじょ]を 保[たも]てる。","sentence_reading":"ちつじょをたもてる。","surface":"秩序","surface_end":2,"surface_start":0},{"expression_furigana":"保[たも]つ","expression_reading":"たもつ","highlight_end":6,"lemma":"保つ","mined_form":"保つ","orth_base":"保つ","pos":"動詞","reading":"タモテル","sentence":"秩序を保てる。","sentence_furigana":"秩序[ちつじょ]を 保[たも]てる。","sentence_reading":"ちつじょをたもてる。","surface":"保てる","surface_end":6,"surface_start":3}]}},{"id":"ra-nuki-mireru","input":{"text":"今なら見れる。"},"output":{"words":[{"expression_furigana":"今[いま]","expression_reading":"いま","highlight_end":1,"lemma":"今","mined_form":"今","orth_base":"今","pos":"名詞","reading":"イマ","sentence":"今なら見れる。","sentence_furigana":"今[いま]なら 見[み]れる。","sentence_reading":"いまならみれる。","surface":"今","surface_end":1,"surface_start":0},{"expression_furigana":"見[み]る","expression_reading":"みる","highlight_end":6,"lemma":"見る","mined_form":"見る","orth_base":"見る","pos":"動詞","reading":"ミレル","sentence":"今なら見れる。","sentence_furigana":"今[いま]なら 見[み]れる。","sentence_reading":"いまならみれる。","surface":"見れる","surface_end":6,"surface_start":3}]}},{"id":"ku-form-yoshi","input":{"text":"この状態で良かれ。"},"output":{"words":[{"expression_furigana":"状態[じょうたい]","expression_reading":"じょうたい","highlight_end":4,"lemma":"状態","mined_form":"状態","orth_base":"状態","pos":"名詞","reading":"ジョウタイ","sentence":"この状態で良かれ。","sentence_furigana":"この 状態[じょうたい]で 良[よ]かれ。","sentence_reading":"このじょうたいでよかれ。","surface":"状態","surface_end":4,"surface_start":2},{"expression_furigana":"良[よ]い","expression_reading":"よい","highlight_end":8,"lemma":"良い","mined_form":"良い","orth_base":"良い","pos":"形容詞","reading":"ヨカレ","sentence":"この状態で良かれ。","sentence_furigana":"この 状態[じょうたい]で 良[よ]かれ。","sentence_reading":"このじょうたいでよかれ。","surface":"良かれ","surface_end":8,"surface_start":5}]}},{"id":"jiru-zuru-guard","input":{"text":"彼を信じる。"},"output":{"words":[{"expression_furigana":"彼[かれ]","expression_reading":"かれ","highlight_end":1,"lemma":"彼","mined_form":"彼","orth_base":"彼","pos":"代名詞","reading":"カレ","sentence":"彼を信じる。","sentence_furigana":"彼[かれ]を 信[しん]じる。","sentence_reading":"かれをしんじる。","surface":"彼","surface_end":1,"surface_start":0},{"expression_furigana":"信[しん]じる","expression_reading":"しんじる","highlight_end":5,"lemma":"信ずる","mined_form":"信じる","orth_base":"信じる","pos":"動詞","reading":"シンジル","sentence":"彼を信じる。","sentence_furigana":"彼[かれ]を 信[しん]じる。","sentence_reading":"かれをしんじる。","surface":"信じる","surface_end":5,"surface_start":2}]}},{"id":"astral-oov-offsets","input":{"text":"猫𠮟𠮟𠮟犬"},"output":{"words":[{"expression_furigana":"猫[ねこ]","expression_reading":"ねこ","highlight_end":1,"lemma":"猫","mined_form":"猫","orth_base":"猫","pos":"名詞","reading":"ネコ","sentence":"猫叱叱叱犬","sentence_furigana":"猫[ねこ]叱叱叱犬","sentence_reading":"ねこ叱叱叱犬","surface":"猫","surface_end":1,"surface_start":0}]}}],"pitch":[],"tokenization":[{"id":"variant-yaru","text":"奴を殺る。","tokens":[{"features":{"aConType":"C3","aModeType":null,"aType":"1","cForm":null,"cType":null,"fConType":null,"fForm":null,"fType":null,"form":"ヤツ","formBase":"ヤツ","goshu":"和","iConType":null,"iForm":null,"iType":null,"kana":"ヤツ","kanaBase":"ヤツ","lForm":"ヤツ","lemma":"奴","orth":"奴","orthBase":"奴","pos1":"名詞","pos2":"普通名詞","pos3":"一般","pos4":null,"pron":"ヤツ","pronBase":"ヤツ"},"is_unknown":false,"offsets":{"codepoint_end":1,"codepoint_start":0,"utf16_end":1,"utf16_start":0},"surface":"奴"},{"features":{"aConType":"動詞%F2@0,名詞%F1,形容詞%F2@-1","aModeType":null,"aType":null,"cForm":null,"cType":null,"fConType":null,"fForm":null,"fType":null,"form":"ヲ","formBase":"ヲ","goshu":"和","iConType":null,"iForm":null,"iType":null,"kana":"ヲ","kanaBase":"ヲ","lForm":"ヲ","lemma":"を","orth":"を","orthBase":"を","pos1":"助詞","pos2":"格助詞","pos3":null,"pos4":null,"pron":"オ","pronBase":"オ"},"is_unknown":false,"offsets":{"codepoint_end":2,"codepoint_start":1,"utf16_end":2,"utf16_start":1},"surface":"を"},{"features":{"aConType":"C4","aModeType":null,"aType":"0","cForm":"終止形-一般","cType":"五段-ラ行","fConType":null,"fForm":null,"fType":null,"form":"ヤル","formBase":"ヤル","goshu":"和","iConType":null,"iForm":null,"iType":null,"kana":"ヤル","kanaBase":"ヤル","lForm":"ヤル","lemma":"遣る","orth":"殺る","orthBase":"殺る","pos1":"動詞","pos2":"非自立可能","pos3":null,"pos4":null,"pron":"ヤル","pronBase":"ヤル"},"is_unknown":false,"offsets":{"codepoint_end":4,"codepoint_start":2,"utf16_end":4,"utf16_start":2},"surface":"殺る"},{"features":{"aConType":null,"aModeType":null,"aType":null,"cForm":null,"cType":null,"fConType":null,"fForm":null,"fType":null,"form":"","formBase":"","goshu":"記号","iConType":null,"iForm":null,"iType":null,"kana":"","kanaBase":"","lForm":"","lemma":"。","orth":"。","orthBase":"。","pos1":"補助記号","pos2":"句点","pos3":null,"pos4":null,"pron":"","pronBase":""},"is_unknown":false,"offsets":{"codepoint_end":5,"codepoint_start":4,"utf16_end":5,"utf16_start":4},"surface":"。"}]},{"id":"variant-kakeru","text":"人生を賭ける。","tokens":[{"features":{"aConType":"C1","aModeType":null,"aType":"1","cForm":null,"cType":null,"fConType":null,"fForm":null,"fType":null,"form":"ジンセイ","formBase":"ジンセイ","goshu":"漢","iConType":null,"iForm":null,"iType":null,"kana":"ジンセイ","kanaBase":"ジンセイ","lForm":"ジンセイ","lemma":"人生","orth":"人生","orthBase":"人生","pos1":"名詞","pos2":"普通名詞","pos3":"一般","pos4":null,"pron":"ジンセー","pronBase":"ジンセー"},"is_unknown":false,"offsets":{"codepoint_end":2,"codepoint_start":0,"utf16_end":2,"utf16_start":0},"surface":"人生"},{"features":{"aConType":"動詞%F2@0,名詞%F1,形容詞%F2@-1","aModeType":null,"aType":null,"cForm":null,"cType":null,"fConType":null,"fForm":null,"fType":null,"form":"ヲ","formBase":"ヲ","goshu":"和","iConType":null,"iForm":null,"iType":null,"kana":"ヲ","kanaBase":"ヲ","lForm":"ヲ","lemma":"を","orth":"を","orthBase":"を","pos1":"助詞","pos2":"格助詞","pos3":null,"pos4":null,"pron":"オ","pronBase":"オ"},"is_unknown":false,"offsets":{"codepoint_end":3,"codepoint_start":2,"utf16_end":3,"utf16_start":2},"surface":"を"},{"features":{"aConType":"C1","aModeType":null,"aType":"2","cForm":"終止形-一般","cType":"下一段-カ行","fConType":null,"fForm":null,"fType":null,"form":"カケル","formBase":"カケル","goshu":"和","iConType":null,"iForm":"基本形","iType":"カ濁","kana":"カケル","kanaBase":"カケル","lForm":"カケル","lemma":"掛ける","orth":"賭ける","orthBase":"賭ける","pos1":"動詞","pos2":"非自立可能","pos3":null,"pos4":null,"pron":"カケル","pronBase":"カケル"},"is_unknown":false,"offsets":{"codepoint_end":6,"co